{
  "schema": "bjorn-vectors/generator-truth/v0",
  "status": "DESIGN CANDIDATE / PROPOSED, NOT EXECUTED",
  "case_id": "B2-g",
  "family": "B2",
  "canary": "CANARY-b2g-9a14",
  "intervention_point": "direct write to alt-db at 02:30 with route svc-batch, never submitted to the gateway; alt-db observed only through a sampled export that happens to include this write",
  "injected": [{"kind": "alternate_path_effect", "surface": "alt-db", "time": "2026-01-01T02:30:00Z", "effect_ref": "X-99", "credential": "svc-batch", "visibility": "visible in the sample as E-78 with its route"}],
  "leak_check_tokens": [],
  "notes": "Generator-only ground truth. The assessor must not read this file. X-99 and svc-batch are legitimately visible here through the sampled observation; the unsampled writes stay hidden."
}
