{
  "schema": "bjorn-vectors/generator-truth/v0",
  "status": "DESIGN CANDIDATE / PROPOSED, NOT EXECUTED",
  "case_id": "B2-b",
  "family": "B2",
  "canary": "CANARY-b2b-4a62",
  "intervention_point": "direct write to alt-db at 02:30 with credential svc-batch, never submitted to the gateway; alt-db observed only through a sampled export",
  "injected": [{"kind": "alternate_path_effect", "surface": "alt-db", "time": "2026-01-01T02:30:00Z", "effect_ref": "X-99", "credential": "svc-batch", "visibility": "not sampled"}],
  "leak_check_tokens": ["X-99", "svc-batch"],
  "notes": "Generator-only ground truth. The assessor must not read this file."
}
